{
  "impact": {
    "icon": "bolt",
    "color": "gold",
    "title": "Selected Impact",
    "content": [
      "At Effortless Ads, led architecture and implementation of a Google Cloud property-data scraper (Puppeteer, Bright Data, 2Captcha, OpenAI API) — thousands of properties processed daily at ~98% primary-source success; reduced recurring third-party data dependencies across 1,000+ Google Ads campaigns.",
      "Built fullstack React portals at Effortless Ads (campaign management, user/company admin, property configuration, automation rules, ingestion/sync dashboards) on Google Ads API and Google Analytics API integrations with Stripe campaign payment flows.",
      "Resolved intermittent failure of millions of marketing messages/month at Drip by diagnosing thread-safety issues in the Shopify gem under Sidekiq and migrating workloads to Resque."
    ]
  },
  "contact": {
    "icon": "contact_mail",
    "color": "blue",
    "title": "Contact",
    "content": [
      {
        "icon": {
          "name": "mail",
          "color": "blue"
        },
        "title": "Email",
        "content": "<a href=\"mailto:fabianozapa@gmail.com\">fabianozapa@gmail.com</a>"
      },
      {
        "icon": {
          "name": "phone_iphone",
          "color": "green"
        },
        "title": "WhatsApp / Mobile",
        "content": "+55 11 95875-8572"
      },
      {
        "icon": {
          "name": "link",
          "color": "indigo"
        },
        "title": "LinkedIn",
        "content": "<a href=\"https://www.linkedin.com/in/fabiano-ishiy-zaparoli-83738b175\">https://www.linkedin.com/in/fabiano-ishiy-zaparoli-83738b175</a>"
      },
      {
        "icon": {
          "name": "location_on",
          "color": "red"
        },
        "title": "Location",
        "content": "Brazil (Remote)"
      }
    ]
  },
  "summary": {
    "icon": "person",
    "color": "blue",
    "title": "Professional Summary",
    "content": [
      "Staff Software Engineer with 14 years building fullstack marketplace and SaaS platforms — pricing engines, inventory systems, third-party integrations, and production debugging at scale. Seeking full-time, embedded independent contractor (1099) roles with US and international companies.",
      "Recently Staff at Effortless Ads on Google Cloud, driving technical direction for property-data ingestion, Google Ads campaign automation, and full-stack product engineering (1,000+ active campaigns; ~60% backend / 40% React). Prior senior individual contributor (IC) work at Drip (100–150M email/SMS events/month) and fullstack engineering at Shift (NASDAQ-listed used-car e-commerce marketplace, SFT). Earlier: CTO at BDS Turismo (B2B travel); co-founder of P2P Milhas (airline mileage marketplace); built the Ikarus flight-search API ecosystem.",
      "Advanced English through years of daily work in US remote teams. Independent contractor for US/international companies since 2020."
    ]
  },
  "projects": {
    "icon": "rocket_launch",
    "color": "green",
    "title": "Current Technical Projects",
    "content": [
      {
        "icon": {
          "name": "smart_toy",
          "color": "green"
        },
        "title": "AI-Assisted Backend Deployment Automation",
        "content": [
          "Personal project focused on orchestrating backend code generation as modular service-like units with strong adherence to structural and behavioral design patterns.",
          "The project simulates engineering workflow stages from implementation through pre-deployment validation using AI-assisted generation pipelines."
        ]
      }
    ]
  },
  "education": {
    "icon": "school",
    "color": "blue",
    "title": "Education",
    "content": [
      {
        "end": {
          "year": 2014,
          "month": 12
        },
        "icon": {
          "name": "school",
          "color": "blue"
        },
        "start": {
          "year": 2008,
          "month": 1
        },
        "title": "Federal University of Minas Gerais (UFMG)",
        "description": "Bachelor’s Degree in Information Systems"
      }
    ]
  },
  "expertise": {
    "icon": "code",
    "color": "blue",
    "title": "Core Technical Expertise",
    "content": [
      {
        "title": "Primary — recent production focus (2020–2026)",
        "content": [
          {
            "title": "Languages & frameworks",
            "content": [
              "Ruby",
              "Ruby on Rails",
              "SpreeCommerce",
              "JavaScript",
              "React",
              "HTML",
              "CSS"
            ]
          },
          {
            "title": "Data & cloud",
            "content": [
              "PostgreSQL",
              "MySQL",
              "Redis",
              "Google Cloud (Cloud Functions, Cloud Run)"
            ]
          },
          {
            "title": "Integrations",
            "content": [
              "REST APIs",
              "SOAP APIs",
              "Webhooks",
              "Google Ads API",
              "Google Analytics API",
              "Stripe"
            ]
          },
          {
            "title": "Data acquisition & AI",
            "content": [
              "Puppeteer",
              "Bright Data",
              "2Captcha",
              "OpenAI API"
            ]
          },
          {
            "title": "Observability & jobs",
            "content": [
              "Datadog",
              "Sidekiq",
              "Resque",
              "GitHub Actions",
              "RSpec",
              "TDD",
              "CI/CD"
            ]
          },
          {
            "title": "Focus areas",
            "content": [
              "Rails architecture",
              "metaprogramming",
              "system integrations",
              "web crawling & data extraction",
              "AI-assisted data pipelines",
              "proptech",
              "API design",
              "production debugging",
              "observability & RCA",
              "transaction management",
              "query optimization"
            ]
          }
        ]
      },
      {
        "title": "Proficient — regular production use",
        "content": [
          "TypeScript",
          "MongoDB",
          "Bootstrap",
          "CircleCI",
          "Sentry",
          "Honeybadger",
          "New Relic",
          "Minitest",
          "Capybara",
          "Docker"
        ]
      },
      {
        "title": "Prior experience — earlier career (2012–2021)",
        "content": [
          "PHP",
          "CakePHP",
          "Laravel",
          "jQuery",
          "Elm",
          "FlightJS",
          "DigitalOcean",
          "Selenium",
          "Git Flow",
          "PagSeguro",
          "Cielo",
          "Mundipag",
          "Stone",
          "Wintour (SOAP ERP)"
        ]
      }
    ]
  },
  "languages": {
    "icon": "translate",
    "color": "pink",
    "title": "Language Skills",
    "content": [
      {
        "icon": {
          "name": "flag",
          "color": "pink"
        },
        "title": "Portuguese",
        "content": "Native"
      },
      {
        "icon": {
          "name": "language",
          "color": "pink"
        },
        "title": "English",
        "content": "Advanced — daily use in remote international teams since 2020 (standups, architecture reviews, documentation, presentations)."
      },
      {
        "icon": {
          "name": "language",
          "color": "pink"
        },
        "title": "Spanish",
        "content": "Intermediate"
      }
    ]
  },
  "engagement": {
    "icon": "handshake",
    "color": "blue",
    "title": null,
    "content": [
      {
        "icon": {
          "name": "work",
          "color": "purple"
        },
        "title": "Engagement",
        "content": "Full-time Independent Contractor — embedded engineering roles · international remote"
      },
      {
        "icon": {
          "name": "badge",
          "color": "teal"
        },
        "title": "Work authorization",
        "content": "Brazilian citizen · remote contractor for US/international companies"
      },
      {
        "icon": {
          "name": "schedule",
          "color": "amber"
        },
        "title": "Availability",
        "content": "Available immediately · fully flexible across all time zones (any US, EU, or international working hours)"
      }
    ]
  },
  "experience": {
    "icon": "work_history",
    "color": "green",
    "title": "Professional Experience",
    "content": [
      {
        "title": {
          "end": {
            "year": 2026,
            "month": 3
          },
          "start": {
            "year": 2023,
            "month": 2
          },
          "company": "Effortless Ads",
          "location": {
            "city": "",
            "state": "",
            "country": "US"
          },
          "job_title": "Staff Software Engineer",
          "contract_type": "Independent contractor (1099)",
          "location_type": "Remote"
        },
        "content": {
          "role": "Staff-level IC on a Google Cloud–hosted Google Ads automation platform. Translated product feature requests into end-to-end implementation strategy — evaluating system-wide impact, selecting technologies, external APIs/services, and code structure. Shared technical direction with peer engineer; mentored developers on codebase and architecture. Full-stack delivery (~60% backend / 40% React).",
          "stack": {
            "others": [
              "Google Cloud Functions",
              "Cloud Run",
              "Puppeteer",
              "Bright Data",
              "2Captcha",
              "OpenAI API (GPT-4x/5.x, text-embedding-3)",
              "Google Ads API",
              "Google Analytics API",
              "Stripe",
              "Datadog",
              "GitHub Actions",
              "RSpec",
              "TDD"
            ],